{
    "UniProt ID": "P56856",
    "sequence": "MSTTTCQVVAFLLSILGLAGCIAATGMDMWSTQDLYDNPVTSVFQYEGLWRSCVRQSSGFTECRPYFTILGLPAMLQAVRALMIVGIVLGAIGLLVSIFALKCIRIGSMEDSAKANMTLTSGIMFIVSGLCAIAGVSVFANMLVTNFWMSTANMYTGMGGMVQTVQTRYTFGAALFVGWVAGGLTLIGGVMMCIACRGLAPEETNYKAVSYHASGHSVAYKPGGFKASTGFGSNTKNKKIYDGGARTEDEVQSYPSKHDYV",
    "Isoform UniProt IDs": [
        "P56856-2"
    ],
    "isoform alignments": [
        "CLUSTAL O(1.2.4) multiple sequence alignment\n\n\nP56856        MSTTTCQVVAFLLSILGLAGCIAATGMDMWSTQDLYDNPVTSVFQYEGLWRSCVRQSSGF\t60\nP56856-2      MAVTACQGLGFVVSLIGIAGIIAATCMDQWSTQDLYNNPVTAVFNYQGLWRSCVRESSGF\t60\n              *:.*:** :.*::*::*:** **** ** *******:****:**:*:********:****\n\nP56856        TECRPYFTILGLPAMLQAVRALMIVGIVLGAIGLLVSIFALKCIRIGSMEDSAKANMTLT\t120\nP56856-2      TECRGYFTLLGLPAMLQAVRALMIVGIVLGAIGLLVSIFALKCIRIGSMEDSAKANMTLT\t120\n              **** ***:***************************************************\n\nP56856        SGIMFIVSGLCAIAGVSVFANMLVTNFWMSTANMYTGMGGMVQTVQTRYTFGAALFVGWV\t180\nP56856-2      SGIMFIVSGLCAIAGVSVFANMLVTNFWMSTANMYTGMGGMVQTVQTRYTFGAALFVGWV\t180\n              ************************************************************\n\nP56856        AGGLTLIGGVMMCIACRGLAPEETNYKAVSYHASGHSVAYKPGGFKASTGFGSNTKNKKI\t240\nP56856-2      AGGLTLIGGVMMCIACRGLAPEETNYKAVSYHASGHSVAYKPGGFKASTGFGSNTKNKKI\t240\n              ************************************************************\n\nP56856        YDGGARTEDEVQSYPSKHDYV\t261\nP56856-2      YDGGARTEDEVQSYPSKHDYV\t261\n              *********************\n"
    ],
    "mass spec peptides": [
        {
            "location": 40,
            "sequence": "TSVFQYEGLWR"
        }
    ]
}